commit	mean_score	min_score	bb	sp	house	got	bb_sil	sp_sil	house_sil	got_sil	cost_usd	status	description	notes
e0684d5	0.0789	0.0553	0.0881	0.0726	0.0553	0.0996	0.0662	0.0093	0.0638	0.0797	1.92	keep	baseline (v3 prompts)	house: 261/414 events cotw excluded; scoring switched to no-cotw
3e8dd2d	0.0778	0.0668	0.0668	0.0703	0.0771	0.0968	0.0439	0.0306	0.0868	0.0804	0.97	discard	scale plotline count by season length	house +0.022 but BB -0.021 (lost Walt:Family line, got Skyler:Suspicion instead); scaling helped procedurals but hurt short serials; need procedural-only targeting
3f77849	0.1025	0.0850	0.0925	0.0850	0.1305	0.1019	0.0771	0.0239	0.1286	0.0867	0.93	keep	scale plotline count for procedural/hybrid only	all shows up! house 0.055→0.131 (9 lines, Vogler arc separated); BB recovered Walt:Family; SP +0.012 (6 lines with Ira/Julia/Aigul); serial ranges untouched = no harm
6961b8b	-	-	0.0917	0.0704	-	-	0.0733	0.0352	-	-	0.24	discard	ablation voting 3→1 in pass1	BB stable (-0.001) but SP -0.015 (5 lines vs 6, lost C-lines); voting stabilizes plotline structure for complex shows; keep voting=3
9d1325b	-	-	0.0731	0.0673	-	-	0.0375	0.0305	-	-	0.39	discard	add distinctness check for plotline goals	BB -0.019 (lost Walt:Family, got Marie:Kleptomania); SP -0.018; distinctness instruction destabilized plotline generation — LLM over-merged or replaced core lines with peripheral ones
n/a	-	-	0.0956	0.0712	-	0.0906	0.0605	-0.0043	-	0.0622	0.43	discard	skip pass3 (--skip-review)	BB +0.003 but SP -0.014 GoT -0.011; pass3 cleans misassignments — net positive; SP sil went negative with 7 lines (too many weak lines without review); keep pass3
ad2d09c	-	0.0758	0.0974	0.0758	-	0.1083	0.0745	0.0348	-	0.0914	0.57	keep	pass obstacle+stakes to pass2	BB +0.005 GoT +0.006 but SP -0.009 (5 vs 6 lines); SP volatile — possibly language mismatch (RU synopses + EN prompts); 2/3 improved; consider replacing SP with EN serial in fast set
